Gene,Gene Symbol,Description,Biological Process (GO),Protein Function (Protein Atlas),Subcellular Location (Protein Atlas),Canonical Pathways,Hallmark Gene Sets
23145,SSPOP,"SCO-spondin, pseudogene",GO:0007155 cell adhesion;GO:0009987 cellular process;GO:0008150 biological_process,,,(M26)PID NFKAPPAB ATYPICAL PATHWAY; (M31)PID BETA CATENIN DEG PATHWAY; (M37)PID NFKAPPAB CANONICAL PATHWAY,
2670,GFAP,glial fibrillary acidic protein,GO:0010625 positive regulation of Schwann cell proliferation;GO:0014010 Schwann cell proliferation;GO:0070777 D-aspartate transport,Disease related genes; Predicted intracellular proteins; Candidate cardiovascular disease genes; Human disease related genes:Nervous system diseases:Neurodegenerative diseases,Intermediate filaments (Supported),,
6497,SKI,SKI proto-oncogene,GO:0043585 nose morphogenesis;GO:0010626 negative regulation of Schwann cell proliferation;GO:0010624 regulation of Schwann cell proliferation,Human disease related genes:Congenital malformations:Other congenital malformations; Predicted intracellular proteins; Disease related genes,Nucleoplasm (Supported); Additional: Nuclear bodies,(M181)PID BMP PATHWAY; (M2)PID SMAD2 3NUCLEAR PATHWAY; (M195)PID CMYB PATHWAY,(M5896)HALLMARK TGF BETA SIGNALING
3699,ITIH3,inter-alpha-trypsin inhibitor heavy chain 3,GO:0030212 hyaluronan metabolic process;GO:1903510 mucopolysaccharide metabolic process;GO:0030203 glycosaminoglycan metabolic process,Predicted secreted proteins,,(M3468)NABA ECM REGULATORS; (M5885)NABA MATRISOME ASSOCIATED; (M5889)NABA MATRISOME,(M5956)HALLMARK KRAS SIGNALING DN
6444,SGCD,sarcoglycan delta,GO:0060977 coronary vasculature morphogenesis;GO:0060976 coronary vasculature development;GO:0086003 cardiac muscle cell contraction,Human disease related genes:Musculoskeletal diseases:Muscular diseases; Human disease related genes:Cardiovascular diseases:Cardiac diseases; Disease related genes,,,(M5909)HALLMARK MYOGENESIS; (M5930)HALLMARK EPITHELIAL MESENCHYMAL TRANSITION
23671,TMEFF2,transmembrane protein with EGF like and two follistatin like domains 2,"GO:0045720 negative regulation of integrin biosynthetic process;GO:0045113 regulation of integrin biosynthetic process;GO:0044319 wound healing, spreading of cells",Predicted secreted proteins,,(M254)PID MYC REPRESS PATHWAY,
