Gene,Gene Symbol,Description,Biological Process (GO),Kinase Class (UniProt),Protein Function (Protein Atlas),Subcellular Location (Protein Atlas),Canonical Pathways,Hallmark Gene Sets
148523,CIART,circadian associated repressor of transcription,GO:0045475 locomotor rhythm;GO:0048512 circadian behavior;GO:0007622 rhythmic behavior,,Predicted intracellular proteins,Nucleoplasm (Approved),,
57464,STRIP2,striatin interacting protein 2,GO:0008360 regulation of cell shape;GO:0022604 regulation of cell morphogenesis;GO:0016477 cell migration,,Predicted intracellular proteins,Cytosol (Approved),,
2046,EPHA8,EPH receptor A8,GO:0071372 cellular response to follicle-stimulating hormone stimulus;GO:0016322 neuron remodeling;GO:0032354 response to follicle-stimulating hormone,yes,Enzymes; ENZYME proteins:Transferases; Predicted intracellular proteins; Cancer-related genes:Candidate cancer biomarkers; Kinases:Tyr protein kinases,,(M177)PID EPHA FWDPATHWAY,
25902,MTHFD1L,methylenetetrahydrofolate dehydrogenase (NADP+ dependent) 1 like,GO:0009257 10-formyltetrahydrofolate biosynthetic process;GO:0009256 10-formyltetrahydrofolate metabolic process;GO:0015942 formate metabolic process,,Enzymes; Predicted intracellular proteins; ENZYME proteins:Ligase,Mitochondria (Enhanced),,
10345,TRDN,triadin,GO:1901846 positive regulation of cell communication by electrical coupling involved in cardiac conduction;GO:0010650 positive regulation of cell communication by electrical coupling;GO:0086036 regulation of cardiac muscle cell membrane potential,,Disease related genes; Transporters:Accessory Factors Involved in Transport; Predicted intracellular proteins; Human disease related genes:Cardiovascular diseases:Cardiac diseases; Potential drug targets,Cytosol;Plasma membrane (Approved); Additional: Nucleoplasm,,
1628,DBP,D-box binding PAR bZIP transcription factor,GO:0048511 rhythmic process;GO:0045944 positive regulation of transcription by RNA polymerase II;GO:0045893 positive regulation of DNA-templated transcription,,Transcription factors:Basic domains; Predicted intracellular proteins,,,(M5942)HALLMARK UV RESPONSE DN
11255,HRH3,histamine receptor H3,GO:0014063 negative regulation of serotonin secretion;GO:0014050 negative regulation of glutamate secretion;GO:0007197 adenylate cyclase-inhibiting G protein-coupled acetylcholine receptor signaling pathway,,FDA approved drug targets:Small molecule drugs; G-protein coupled receptors:GPCRs excl olfactory receptors,,,
7008,TEF,"TEF transcription factor, PAR bZIP family member",GO:0048511 rhythmic process;GO:0045944 positive regulation of transcription by RNA polymerase II;GO:0045893 positive regulation of DNA-templated transcription,,Transcription factors:Basic domains; Predicted intracellular proteins,,,
54894,RNF43,ring finger protein 43,GO:0038018 Wnt receptor catabolic process;GO:0032801 receptor catabolic process;GO:0043112 receptor metabolic process,,Enzymes; Disease related genes; ENZYME proteins:Transferases; Cancer-related genes:Mutational cancer driver genes; Potential drug targets,,(M19)PID P73PATHWAY,
