Gene,Gene Symbol,Description,Biological Process (GO),Kinase Class (UniProt),Protein Function (Protein Atlas),Subcellular Location (Protein Atlas),Canonical Pathways,Hallmark Gene Sets
10345,TRDN,triadin,GO:1901846 positive regulation of cell communication by electrical coupling involved in cardiac conduction;GO:0010650 positive regulation of cell communication by electrical coupling;GO:0086036 regulation of cardiac muscle cell membrane potential,,Disease related genes; Transporters:Accessory Factors Involved in Transport; Predicted intracellular proteins; Human disease related genes:Cardiovascular diseases:Cardiac diseases; Potential drug targets,Cytosol;Plasma membrane (Approved); Additional: Nucleoplasm,,
5800,PTPRO,protein tyrosine phosphatase receptor type O,GO:0036060 slit diaphragm assembly;GO:0090260 negative regulation of retinal ganglion cell axon guidance;GO:1902668 negative regulation of axon guidance,,Enzymes; Human disease related genes:Urinary system diseases:Kidney diseases; Potential drug targets; Predicted intracellular proteins; Cancer-related genes:Candidate cancer biomarkers; ENZYME proteins:Hydrolases; Disease related genes,,(M231)PID KIT PATHWAY,
800,CALD1,caldesmon 1,GO:0051017 actin filament bundle assembly;GO:0061572 actin filament bundle organization;GO:0006936 muscle contraction,,Predicted intracellular proteins,Actin filaments;Plasma membrane (Enhanced),,(M5930)HALLMARK EPITHELIAL MESENCHYMAL TRANSITION
395,ARHGAP6,Rho GTPase activating protein 6,GO:0051895 negative regulation of focal adhesion assembly;GO:0150118 negative regulation of cell-substrate junction organization;GO:0007202 activation of phospholipase C activity,,Predicted intracellular proteins,Cytosol (Supported),(M68)PID RHOA REG PATHWAY,
145508,CEP128,centrosomal protein 128,GO:0120316 sperm flagellum assembly;GO:0044458 motile cilium assembly;GO:0030317 flagellated sperm motility,,Predicted intracellular proteins,Centrosome (Supported),,
158326,FREM1,FRAS1 related extracellular matrix 1,GO:0097094 craniofacial suture morphogenesis;GO:1904888 cranial skeletal system development;GO:0060349 bone morphogenesis,,Predicted secreted proteins; Human disease related genes:Congenital malformations:Congenital malformations of the musculoskeletal system; Predicted intracellular proteins; Human disease related genes:Congenital malformations:Other congenital malformations; Disease related genes,,(M5880)NABA ECM AFFILIATED; (M5885)NABA MATRISOME ASSOCIATED; (M5889)NABA MATRISOME,
658,BMPR1B,bone morphogenetic protein receptor type 1B,GO:0001550 ovarian cumulus expansion;GO:1902731 negative regulation of chondrocyte proliferation;GO:0048165 fused antrum stage,yes,Enzymes; Human disease related genes:Congenital malformations:Congenital malformations of the musculoskeletal system; Potential drug targets; Kinases:TKL Ser/Thr protein kinases; CD markers; ENZYME proteins:Transferases; Predicted intracellular proteins; Disease related genes,,(M181)PID BMP PATHWAY,(M5908)HALLMARK ANDROGEN RESPONSE; (M5935)HALLMARK FATTY ACID METABOLISM; (M5956)HALLMARK KRAS SIGNALING DN
